{
  "contract": "io.clayz.presentation.metadata-dataset-export/1.0",
  "dataset_id": "metadata-dataset-7b92844f451fd0b94469",
  "created_at": "2026-08-23T11:00:00Z",
  "provider_snapshot": {
    "provider_id": "builtin-catalog",
    "digest": "e5d8253d19c3a0b738156d0eaeb49169f11eca467fd4222a972a3db819054f67",
    "record_count": 24
  },
  "record_types": [
    "composition-pattern",
    "failure-pattern",
    "reference",
    "sequence"
  ],
  "records": [
    {
      "record_id": "pattern.asymmetric-evidence-to-decision",
      "record_type": "composition-pattern",
      "source_id": "clayz-pattern-asymmetric-evidence-to-decision",
      "source_revision": "1",
      "source_sha256": "4fc7810c5768f2b4f21f6875c578937e35da7db56fb843eca4e0bb0031fcdd03",
      "classification": {
        "stages": [
          "art-direction"
        ],
        "task_modes": [
          "new-build",
          "redesign"
        ],
        "page_roles": [
          "comparison"
        ],
        "semantic_relations": [
          "supports"
        ],
        "purpose_tags": [
          "evidence-led"
        ],
        "languages": [
          "en-US",
          "zh-CN"
        ],
        "failure_signals": [],
        "asset_class": "method",
        "brand_scope": "none"
      },
      "metadata": {
        "contract": "io.clayz.presentation.composition-pattern/1.0",
        "composition_pattern_id": "pattern.asymmetric-evidence-to-decision",
        "revision": "1",
        "title": "Asymmetric evidence to decision",
        "summary": "A dominant evidence field supports a smaller but visually decisive implication without reducing the page to equal cards.",
        "selection": {
          "task_modes": [
            "new-build",
            "redesign"
          ],
          "page_roles": [
            "comparison"
          ],
          "semantic_relations": [
            "supports"
          ],
          "purpose_tags": [
            "evidence-led"
          ],
          "languages": [
            "en-US",
            "zh-CN"
          ]
        },
        "mapping": {
          "first_visual_role": "primary evidence",
          "backbone_relation": "evidence supports decision implication",
          "reading_path": "dominant evidence to supporting findings to decision implication",
          "spatial_rules": [
            {
              "semantic_relation": "supports",
              "spatial_behavior": "allocate more area to evidence while keeping the implication visually final"
            },
            {
              "semantic_relation": "compares",
              "spatial_behavior": "preserve comparable evidence scales inside the dominant field"
            }
          ],
          "object_hierarchy": [
            "primary evidence",
            "supporting findings",
            "decision implication",
            "source note"
          ]
        },
        "applicability": {
          "requires": [
            "one evidence object is the approved first visual",
            "a decision implication is supported by that evidence"
          ],
          "avoid_when": [
            "both sides are independent peer decisions",
            "evidence is absent or unverified"
          ]
        },
        "failure_pattern_ids": [
          "failure.equal-weight-flattening",
          "failure.semantic-visual-mismatch"
        ],
        "decision_contract": {
          "selection_reason_required": true,
          "rejection_reason_required": true,
          "constraints_required": true,
          "expected_visual_effect_required": true
        },
        "guards": {
          "brand_neutral": true,
          "original_method": true,
          "theme_independent": true,
          "visual_variant_independent": true,
          "layout_contract_independent": true,
          "coordinates_deferred": true,
          "editable_objects_required": true,
          "flattened_output_forbidden": true,
          "no_embedded_assets": true
        }
      }
    },
    {
      "record_id": "pattern.flow-with-governed-checkpoint",
      "record_type": "composition-pattern",
      "source_id": "clayz-pattern-flow-with-governed-checkpoint",
      "source_revision": "1",
      "source_sha256": "b587c5e20da351617a1499bfca56e34c12d265ed1d11c45438a1dbafebaad826",
      "classification": {
        "stages": [
          "art-direction"
        ],
        "task_modes": [
          "new-build",
          "redesign"
        ],
        "page_roles": [
          "process"
        ],
        "semantic_relations": [
          "sequence"
        ],
        "purpose_tags": [
          "process-led"
        ],
        "languages": [
          "en-US",
          "zh-CN"
        ],
        "failure_signals": [],
        "asset_class": "method",
        "brand_scope": "none"
      },
      "metadata": {
        "contract": "io.clayz.presentation.composition-pattern/1.0",
        "composition_pattern_id": "pattern.flow-with-governed-checkpoint",
        "revision": "1",
        "title": "Flow with governed checkpoint",
        "summary": "An ordered operational flow remains dominant while one checkpoint and its outcome are distinguished without breaking sequence continuity.",
        "selection": {
          "task_modes": [
            "new-build",
            "redesign"
          ],
          "page_roles": [
            "process"
          ],
          "semantic_relations": [
            "sequence"
          ],
          "purpose_tags": [
            "process-led"
          ],
          "languages": [
            "en-US",
            "zh-CN"
          ]
        },
        "mapping": {
          "first_visual_role": "ordered stage backbone",
          "backbone_relation": "stages progress through one governed checkpoint to an outcome",
          "reading_path": "stage order to checkpoint to outcome",
          "spatial_rules": [
            {
              "semantic_relation": "sequence",
              "spatial_behavior": "maintain one continuous ordered axis"
            },
            {
              "semantic_relation": "condition",
              "spatial_behavior": "attach the checkpoint to the stage it governs rather than creating a detached panel"
            }
          ],
          "object_hierarchy": [
            "ordered stage backbone",
            "current stage",
            "governed checkpoint",
            "outcome"
          ]
        },
        "applicability": {
          "requires": [
            "stage order is semantically meaningful",
            "one checkpoint changes whether the flow may proceed"
          ],
          "avoid_when": [
            "steps are independent and unordered",
            "the checkpoint is only decorative emphasis"
          ]
        },
        "failure_pattern_ids": [
          "failure.sequence-order-loss",
          "failure.semantic-visual-mismatch"
        ],
        "decision_contract": {
          "selection_reason_required": true,
          "rejection_reason_required": true,
          "constraints_required": true,
          "expected_visual_effect_required": true
        },
        "guards": {
          "brand_neutral": true,
          "original_method": true,
          "theme_independent": true,
          "visual_variant_independent": true,
          "layout_contract_independent": true,
          "coordinates_deferred": true,
          "editable_objects_required": true,
          "flattened_output_forbidden": true,
          "no_embedded_assets": true
        }
      }
    },
    {
      "record_id": "pattern.hero-with-evidence-cluster",
      "record_type": "composition-pattern",
      "source_id": "clayz-pattern-hero-with-evidence-cluster",
      "source_revision": "1",
      "source_sha256": "9d20fae718292a967b28646c07b17c48fbc6a7a40cb039cecc6dff5029eca9de",
      "classification": {
        "stages": [
          "art-direction"
        ],
        "task_modes": [
          "new-build",
          "redesign"
        ],
        "page_roles": [
          "argument"
        ],
        "semantic_relations": [
          "supports"
        ],
        "purpose_tags": [
          "hero-led"
        ],
        "languages": [
          "en-US",
          "zh-CN"
        ],
        "failure_signals": [],
        "asset_class": "method",
        "brand_scope": "none"
      },
      "metadata": {
        "contract": "io.clayz.presentation.composition-pattern/1.0",
        "composition_pattern_id": "pattern.hero-with-evidence-cluster",
        "revision": "1",
        "title": "Hero with evidence cluster",
        "summary": "One approved proposition or visual dominates while heterogeneous evidence remains grouped as support instead of competing as peers.",
        "selection": {
          "task_modes": [
            "new-build",
            "redesign"
          ],
          "page_roles": [
            "argument"
          ],
          "semantic_relations": [
            "supports"
          ],
          "purpose_tags": [
            "hero-led"
          ],
          "languages": [
            "en-US",
            "zh-CN"
          ]
        },
        "mapping": {
          "first_visual_role": "approved hero proposition",
          "backbone_relation": "one proposition is supported by an evidence cluster",
          "reading_path": "hero proposition to evidence cluster to closing qualification",
          "spatial_rules": [
            {
              "semantic_relation": "supports",
              "spatial_behavior": "group evidence near the proposition without equalizing its visual weight"
            },
            {
              "semantic_relation": "qualifies",
              "spatial_behavior": "keep qualifications visually subordinate but readable"
            }
          ],
          "object_hierarchy": [
            "hero proposition",
            "evidence cluster",
            "qualification"
          ]
        },
        "applicability": {
          "requires": [